;;;;;;;;;;;;;x,,,,,,,,,,,,,,,,,,,,,,
EVTDESC66553;The British Empire have generously agreed to give us back our former colonies. Perhaps this is the start of a new era in our relations?;;;;;;x;;;;;;;;;;;
EVTOPTA66553;So long as I don't have to eat their food or love their women.;;;;;;x;;;;;;;;;;;
EVTNAME66554;A Tempting Offer;;;;;;x;;;;;;;;;;;n
EVTDESC66554;Unfortunately, the British Empire refuses to consider letting us have our colonies back. However, they are willing to compensate us generously if we agree to drop our claims to the islands.;;;;;;x;;;;;;;;;;;
EVTOPTA66554;Better that we be paid in gold than we pay them in blood.;;;;;;x;;;;;;;;;;;
EVTOPTB66554;We will not sell our nation's honor for money!;;;;;;x;;;;;;;;;;;
EVTNAME66556;The French Accept;;;;;;x;;;;;;;;;;;
EVTDESC66556;The French have agreed to sell us the claims to the colonies. Our bankers are getting ready to process the transaction, and our diplomats are celebrating a possible aversion of war.;;;;;;x;;;;;;;;;;;
EVTOPTA66556;I guess one can deal with these people.;;;;;;x;;;;;;;;;;;
EVTNAME66557;The French Refuse;;;;;;x;;;;;;;;;;;
EVTDESC66557;Sadly, the French have not taken our offer of compensation well at all, and have considered it an insult. It looks as though we shall have to prepare for eventual war.;;;;;;x;;;;;;;;;;;
EVTOPTA66557;Is money really so dirty to them?;;;;;;x;;;;;;;;;;;
EVTNAME86000;The Rise of Nations;;;;;;x;;;;;;;;;;;
EVTDESC86000;Won over by the promises of the enemy, the non-French peoples of our Empire have risen against us and joined in a common confederation devoted to securing our defeat and gaining independence.;;;;;;x;;;;;;;;;;;
EVTOPTA86000;We shall crush them too!;;;;;;x;;;;;;;;;;;
EVTNAME86001;The End of the Coalition;;;;;;x;;;;;;;;;;;
EVTDESC86001;Our nation has successfully retained its imperium over its non-French populations. The morale of the nationalist movements is shattered, and any hopes that their coalition will rise again in the future have been dashed.;;;;;;x;;;;;;;;;;;
EVTOPTA86001;Vive l'Empire!;;;;;;x;;;;;;;;;;;
EVTNAME86003;The Coalition Victory;;;;;;x;;;;;;;;;;;
EVTDESC86003;The Coalition of Nations has fulfilled their obligations in the French Civil War, and have now been given the freedom we so desire. The French have honored their deal and removed all claims on our country. A new dawn shines over the world, a world in which we are free.;;;;;;x;;;;;;;;;;;
EVTOPTA86003;We raise a glass to our new freedom!;;;;;;x;;;;;;;;;;;
EVTNAME86029;Our Weary People;;;;;;x;;;;;;;;;;;
EVTDESC86029;Our country can no longer fight, not because we have been defeated, but because we cannot handle any more violence. The continuation of this war benefits none other than our enemies who pounce on our weakness. We surrender with hopes France can stand strong once more.;;;;;;x;;;;;;;;;;;
EVTOPTA86029;For France and her people.;;;;;;x;;;;;;;;;;;
EVTNAME86080;The Greek War of Independence;;;;;;x;;;;;;;;;;;
EVTDESC86080;Emboldened by the funding from the Christian powers, the Greek subjects of the sultan have risen in rebellion against us. Though on their own they are weak, it is quite possible that powerful nations awash with romatic ideas of a free Greece will intervene to aid them if we do not put this rebellion down quickly. If a foreign power does interced, than making a peace with Greece will thus lead to us losing our claim to the land.;;;;;;x;;;;;;;;;;;
EVTOPTA86080;Filthy Swine.;;;;;;x;;;;;;;;;;;
EVTNAME86081;Greek Independence;;;;;;x;;;;;;;;;;;
EVTDESC86081;Today word has reached us that the Ottoman Empire has agreed to release a good deal of Greek territory as a free Greek state. This is a glorious day for both the Greeks and for those who admire Greek culture, and our nation's sucessful intervention gives some of today's glory to us.;;;;;;x;;;;;;;;;;;
EVTOPTA86081;Long live free Greece!;;;;;;x;;;;;;;;;;;
EVTNAME86082;Greek Independence;;;;;;x;;;;;;;;;;;
EVTDESC86082;The combined pressure of the Greek rebels and the Christian Powers has forced us to agree to the establishment of a free Greek state. After long negotiations, the borders of this new nation have been drawn on the map, and we have abandoned all claims to the land. Today is an ignoble day for the descendants of Osman.;;;;;;x;;;;;;;;;;;
EVTOPTA86082;We're better off without them.;;;;;;x;;;;;;;;;;;
EVTNAME600023;The Reorganization of Austria;;;;;;x;;;;;;;;;;;
EVTDESC600023;Now that we have granted Hungary equal status within our empire, the state is launching a massive reorganization of the bureaucracy to adjust to the situation. The flags are being changed, maps are being redrawn, and Hungary's new Magyar government is being intertwined with ours. Peaceful, if a bit messy, days will be with us for a long time.;;;;;;x;;;;;;;;;;;
EVTOPTA600023;All Hail the Emperor and King!;;;;;;x;;;;;;;;;;;
EVTNAME600024;A Return to Germanic Civilization;;;;;;x;;;;;;;;;;;
EVTDESC600024;Circumstances have led Hungary to leave the dual monarchy. While this certainly means a loss of power for our nation, many are welcoming the removal of Hungarians from our Empire.;;;;;;x;;;;;;;;;;;
EVTOPTA600024;What did they really have to offer us anyway?;;;;;;x;;;;;;;;;;;
EVTNAME600025;The Hungarian Menace;;;;;;x;;;;;;;;;;;
EVTDESC600025;While Hungary has long been under the rule of the Hapsburgs, the lack of threat from the Turks have led many Hungarians to begin pushing for greater independence for their nation. While the situation is under control for now, our spies in the Hungarian nationalist movements report that if concessions are not made to Hungary within a few years, the Hungarians will likely revolt against us if our nation has become vulnerable from having a War Exhaustion score of 30 or higher.;;;;;;x;;;;;;;;;;;
EVTOPTA600025;Perhaps we should consider a compromise.;;;;;;x;;;;;;;;;;;
EVTNAME600026;The Hungarian Revolution;;;;;;x;;;;;;;;;;;
EVTDESC600026;It seems our unwillingness to compromise with the Hungarians in our empire may have been a mistake. At our current moment of great vulnerability, a group of traitorous Hungarians has risen the flag of revolution, and will not rest until either Hungary is free or until they are dead.;;;;;;x;;;;;;;;;;;
EVTOPTA600026;We will crush them!;;;;;;x;;;;;;;;;;;
EVTNAME600027;The Claim to Spain;;;;;;x;;;;;;;;;;;
EVTDESC600027;When Napoleon invaded Spain and put his brother on the throne, few accepted him as the legitimate king. However, the true heir and his family were kept imprisoned by Napoleon until they died childless. As a result, the closest living relative happens to be the King of Sicily, due to a claim from Charles III of Spain. A delegation from the King has arrived today, demanding we recognize his claim to the throne and unite with Sicily as one nation. This seems like it might be the right time to restore the monarchy, but factions in the Cortes are divided. Some say we should offer him the crown on his own terms, while some say we should demand he rule constitutionally. Some radicals even claim we should refuse to submit to a European monarch.;;;;;;x;;;;;;;;;;;
EVTOPTA600027;He is our rightful sovereign.;;;;;;x;;;;;;;;;;;
EVTOPTB600027;We demand he rule in a liberal fashion.;;;;;;x;;;;;;;;;;;
EVTOPTC600027;Our destiny lies in the Americas, not Europe.;;;;;;x;;;;;;;;;;;
EVTNAME600028;Gaining the Throne;;;;;;x;;;;;;;;;;;
EVTDESC600028;The silly liberals in the Cortes have thrown away their principles in their desparation for a rightful king. Though our accession to the throne is technically in violation of the Treaty of Utrecht, few in Europe other than France care anymore about such relics. Taking the throne will also lead to us losing our claim on the Kingdom of Naples.;;;;;;x;;;;;;;;;;;
EVTOPTA600028;Never match wills with a Sicilian when a throne is on the line.;;;;;;x;;;;;;;;;;;
EVTNAME600029;An Offer of the Throne;;;;;;x;;;;;;;;;;;
EVTDESC600029;The liberals in the Cortes have shown willingness to make us King of Spain, but at a cost. If we wish to rule them, we must agree to accept a constitution for Spain. Further, an accession to the throne is technically in violation of the Treaty of Utrecht, though few in Europe other than France care anymore about such relics. Taking the throne will also lead to us losing our claim on the Kingdom of Naples.;;;;;;x;;;;;;;;;;;
EVTOPTA600029;Havana is worth some parchment.;;;;;;x;;;;;;;;;;;
EVTOPTB600029;We rule by divine right!;;;;;;x;;;;;;;;;;;
EVTNAME600030;The Royal Rejection;;;;;;x;;;;;;;;;;;
EVTDESC600030;It seems the decades away from Europe has gone to the heads of the Spaniards. They have denied our claim to the throne entirely and have decided to reject the House of Bourbon as legitimate rulers.;;;;;;x;;;;;;;;;;;
EVTOPTA600030;Liberal bastards.;;;;;;x;;;;;;;;;;;
EVTNAME600031;The Royal Rejection;;;;;;x;;;;;;;;;;;
EVTDESC600031;It seems that for some, despotism is more valuable than legitimacy. The King of Sicily has refused our offer, and has decided to continue ruling as an absolute monarch.;;;;;;x;;;;;;;;;;;
EVTOPTA600031;Reactionary bastard.;;;;;;x;;;;;;;;;;;
EVTNAME600032;The Deal is Done;;;;;;x;;;;;;;;;;;
EVTDESC600032;With the King of Sicily agreeing to the demands of the liberals in the Cubano Cortes, Spain today has its rightful sovereign back on the the throne!;;;;;;x;;;;;;;;;;;
EVTOPTA600032;Onwards to Madrid!;;;;;;x;;;;;;;;;;;
EVTNAME600033;The Death of Old Spain;;;;;;x;;;;;;;;;;;
EVTDESC600033;News has reached us today that the representatives of the old Spanish government in exile have today abandoned their claims to the Iberian Peninsula. As such, we are being recongized by the world as the only rightful Spanish government.;;;;;;x;;;;;;;;;;;
EVTOPTA600033;Long Live New Spain!;;;;;;x;;;;;;;;;;;
EVTNAME600034;The True Spain?;;;;;;x;;;;;;;;;;;
EVTDESC600034;Now that we are no longer a puppet of the French, calls echo from all over the nation for the re-unification of Spain and the return of the true government in exile. Giving in to popular demand will, of course, mean the end for our government, but refusing will surely not be taken well by the populace.;;;;;;x;;;;;;;;;;;
EVTOPTA600034;We graciously surrender.;;;;;;x;;;;;;;;;;;
EVTOPTB600034;WE are the True Spanish Nation!;;;;;;x;;;;;;;;;;;
EVTNAME600035;The Reunification;;;;;;x;;;;;;;;;;;
EVTDESC600035;The illegitimate rulers of the Spanish puppet state have, thankfully, given in to popular demand and surrendered Spain to us. Today our nation is whole once more.;;;;;;x;;;;;;;;;;;
EVTOPTA600035;Viva Espa?!;;;;;;x;;;;;;;;;;;
EVTNAME600036;No Reunification;;;;;;x;;;;;;;;;;;
EVTDESC600036;The illegitimate rulers of the Spanish puppet state have, sadly, refused to give in to popular demand and surrender Spain to us. It shall mean war before our nation is whole once more.;;;;;;x;;;;;;;;;;;
EVTOPTA600036;We shall prevail!;;;;;;x;;;;;;;;;;;
EVTNAME600037;Indian Equality;;;;;;x;;;;;;;;;;;
EVTDESC600037;"Shockingly, it seems as though the barbaric Indians of the Native Confederation are savage no longer. Having reached a level of civilization equivalent to ours, they have announced to the world today that they intend to take their place among the nations of the West. As such, our claims to the supposed ""unused"" land that they hold no longer has validity in the eyes of the world.";;;;;;x;;;;;;;;;;;
EVTOPTA600037;Drat.;;;;;;x;;;;;;;;;;;
EVTNAME600038;Native Equality;;;;;;x;;;;;;;;;;;
EVTDESC600038;Under our tutelage, the Native Confederation has grown over the decades to the point that they can no longer be considered any more backwards than the West. Today they have announced their equality to the world, which also reflects well on our drive to civilize the backwards peoples of the world.;;;;;;x;;;;;;;;;;;
EVTOPTA600038;Hurrah!;;;;;;x;;;;;;;;;;;
EVTNAME600039;Imperial Experts;;;;;;x;;;;;;;;;;;
EVTDESC600039;As a dominion of the British Empire, our people both suffer and benefit from our puppet status. Though we are not free to form our own foreign policy, the Imperial government takes an interest in our welfare, and often sends experts to help us modernize our technology so we can better combat those who would take our land.;;;;;;x;;;;;;;;;;;
EVTOPTA600039;"What is this ""wheel"" they keep talking about?";;;;;;x;;;;;;;;;;;
EVTNAME600040;The Capital, Occupied;;;;;;x;;;;;;;;;;;
EVTDESC600040;The enemy has occuped our capital. The effects of this cannot be understated, as all over our nation, the populace is panicking. Rebel groups seeing a chance to overthrow the government are forming, families are fleeing wherever they can go to get away from the enemy, the infrastructure of the nation is shutting down, and calls for peace at any price grow louder each day. Until we retake our capital, the chances of this war ending well look grim.;;;;;;x;;;;;;;;;;;
EVTOPTA600040;We must continue the fight!;;;;;;x;;;;;;;;;;;
EVTNAME600041;The Capital, Taken;;;;;;x;;;;;;;;;;;
EVTDESC600041;The enemy no longer controls our capital. The people are calming down, and life is returning to some state of normalcy-- at least, whatever can be called normal in a time of hardship.;;;;;;x;;;;;;;;;;;
EVTOPTA600041;Our sacred soil is ours once more.;;;;;;x;;;;;;;;;;;
EVTNAME600045;The Liberal Pope?;;;;;;x;;;;;;;;;;;
EVTDESC600045;In an event that has shocked Europe, the Papal Conclave of 1846 has elected Giovanni Maria Mastai-Ferretti, a man widely believed to be a liberal and an Italian nationalist, as the new Pope. Taking the name Pope Pius IX, many in Italy see him as the possible head of a unified Italy. In the next few years, many Italian nationalists will look towards the Papal State to see if Pius really represents the spirit of reform Italy needs.;;;;;;x;;;;;;;;;;;
EVTOPTA600045;Pius IX is indeed a reformer.;;;;;;x;;;;;;;;;;;
EVTOPTB600045;Pius IX is more interested in spiritual matters.;;;;;;x;;;;;;;;;;;
EVTNAME600046;The Work of Redemption;;;;;;x;;;;;;;;;;;
EVTDESC600046;Giuseppe Garibaldi, a general famous both for his skill in waging war in South America and for his radical Italian nationalism, has today shown up at the Papal Palace. Apparently seeing in Pius IX the figure of the man who will unify Italy in a Work of Redemption, he has offered to put himself at the head of an effort to conquer Italy under the Pope's rule through the raising of voluntary militias. Accepting could mean control over Italy, but it would also completely alienate us from the other Italian states.;;;;;;x;;;;;;;;;;;
EVTOPTA600046;For the Church and the Fatherland!;;;;;;x;;;;;;;;;;;
EVTOPTB600046;This man seems a bit mad.;;;;;;x;;;;;;;;;;;
EVTNAME600051;The Papal Plot;;;;;;x;;;;;;;;;;;
EVTNAME600052;The New Republic;;;;;;x;;;;;;;;;;;
EVTDESC600052;We are hearing whispers that Garibaldi has conquered an Italian state. Let us see and wait what comes of this.;;;;;;x;;;;;;;;;;;
EVTOPTA600052;Horrid.;;;;;;x;;;;;;;;;;;
EVTNAME600054;A Present for Pius;;;;;;x;;;;;;;;;;;
EVTDESC600054;Garibaldi was not all talk, it seems. One of the Italian nations has today fallen to his forces, and he has declared its immediate unification with us under the new national state of Italy.;;;;;;x;;;;;;;;;;;
EVTOPTA600054;Upon this Rock we shall build a nation!;;;;;;x;;;;;;;;;;;
EVTNAME600056;Building the Nation;;;;;;x;;;;;;;;;;;
EVTDESC600056;Garibaldi's forces have today conquered another state, and it has been put under Italian control.;;;;;;x;;;;;;;;;;;
EVTOPTA600056;God bless the man.;;;;;;x;;;;;;;;;;;
EVTNAME600057;The End of Italy;;;;;;x;;;;;;;;;;;
EVTDESC600057;The experiment of liberalism and nationalism that was the state of Italy has today ended. No longer will anyone question the right of the existing Italian states to maintain their independence.;;;;;;x;;;;;;;;;;;
EVTOPTA600057;Don't bother me with such petty news.;;;;;;x;;;;;;;;;;;
EVTNAME600063;The Rise of the Redshirts;;;;;;x;;;;;;;;;;;
EVTDESC600063;Due to a recent liberal and nationalist surge that has occured throughout Europe, many Italians are increasingly seeing the current division of the Italian peninsula as a violation of the common ties of the Italian people, and the diverse Italian states as illegitimate. Such sentiments have lead to cries for a united and liberal Italy, and taking advantage of this situation, the famed freedom fighter Giuseppe Garibaldi has landed from exile in Italy. He is calling upon Italians to rise up against their government and estabish a united Italian nation, and is forming a militia of Redshirts to accomplish this. While a small state taken by him will likely simply lose its monarchy, if we find ourselves in a position of being a great power, we stand a chance at influencing Garibaldi to let us be the ones to lead this Risorgimento.;;;;;;x;;;;;;;;;;;
EVTOPTA600063;Blasted liberals.;;;;;;x;;;;;;;;;;;
EVTNAME600069;Repubblica del Popolo;;;;;;x;;;;;;;;;;;
EVTDESC600069;Garibaldi, acting as dictator for the provisional government, has determined that our nation is ripe for permanent republicanism. However, this is merely on a provisional basis, and if a larger state takes on the mantle of Italy, we will forcibly be inherited by them.;;;;;;x;;;;;;;;;;;
EVTOPTA600069;This is a humiliation!;;;;;;x;;;;;;;;;;;
EVTNAME600070;Italia del Popolo;;;;;;x;;;;;;;;;;;
EVTDESC600070;Garibaldi, acting as dictator for the provisional government, has determined that our state is powerful enough to potentially unify the Italian peninsula and create, not an Italy of Caesars or of Popes, but an Italy of the People. As such, our new republic must now lead the fight against the other Italian states, who will surely wish to destroy us.;;;;;;x;;;;;;;;;;;
EVTOPTA600070;Long live the Italian people!;;;;;;x;;;;;;;;;;;
EVTNAME600071;Garibaldi Takes Action;;;;;;x;;;;;;;;;;;
EVTDESC600071;One of the Italian states has today fallen before the forces of Garibaldi and his voluntary militia of redshirts, and has been incorporated into his plans to forcibly unite Italy. We must prepare to fight against these forces and all their sympathizers.;;;;;;x;;;;;;;;;;;
EVTOPTA600071;May nationalism by damned!;;;;;;x;;;;;;;;;;;
EVTNAME600072;Shackled to Italy;;;;;;x;;;;;;;;;;;
EVTDESC600072;Garibaldi, acting as dictator for the provisional government, has determined that our nation is to be linked to the newly formed Italian state. Our time as a free state is at an end.;;;;;;x;;;;;;;;;;;
EVTOPTA600072;I don't want to be an Italian!;;;;;;x;;;;;;;;;;;
EVTNAME600073;Long Live Italy;;;;;;x;;;;;;;;;;;
EVTDESC600073;Because of our dominant position on the Italian peninsula, Garibaldi, though a committed republican, has swallowed his pride for the sake of a united Italy and has appeared before us today, offering us his recent conquest and the mantle of the Kingdom of Italy. Crowds of tens of thousands have escorted him here, and throughout our nation, the cries of millions echo to God as our people praise the birth of a united Italy.;;;;;;x;;;;;;;;;;;
EVTOPTA600073;Long live Italy!;;;;;;x;;;;;;;;;;;
EVTOPTB600073;I'll just take the land, thanks.;;;;;;x;;;;;;;;;;;
EVTNAME600075;Italy Grows Larger;;;;;;x;;;;;;;;;;;
EVTDESC600075;Thanks to Garibaldi's Redshirts, our nation has absorbed another of his conquests today, adding it to our holdings and increasing the size of the new Italy.;;;;;;x;;;;;;;;;;;
EVTOPTA600075;More people to tax.;;;;;;x;;;;;;;;;;;
EVTNAME600076;The Italy of the Popes;;;;;;x;;;;;;;;;;;
EVTDESC600076;All over Italy, millions of joyous Italians are hearing of our quest to unify Italy, and are praising the name of God and the Pope. Many are planning to join Garibaldi and rise against their state in the hopes of joining our holy nation.;;;;;;x;;;;;;;;;;;
EVTOPTA600076;Upon this rock we shall build a nation!.;;;;;;x;;;;;;;;;;;
EVTNAME600077;Italy, the Child of Napoleon;;;;;;x;;;;;;;;;;;
EVTDESC600077;All over Italy, millions of joyous Italians are hearing of our quest to unify Italy, and are praising the name of King Napoleon and his great father, Napoleon I of France. Many are planning to join Garibaldi and rise against their state in the hopes of joining our glorious nation.;;;;;;x;;;;;;;;;;;
EVTOPTA600077;Italy shall be ruled by true Italians!;;;;;;x;;;;;;;;;;;
EVTNAME600078;Italy, the Toy of Murat;;;;;;x;;;;;;;;;;;
EVTDESC600078;All over Italy, millions of terrified Italians are hearing of our quest to unify Italy, and are cautiously praising the name of Murat the Mad while looking over their shoulders, as if someone is watching them. Many are planning to join Garibaldi and rise against their state, many simply because they fear the consequences of not doing so.;;;;;;x;;;;;;;;;;;
EVTOPTA600078;Italy shall be ruled by true Italians!;;;;;;x;;;;;;;;;;;
EVTNAME600079;Italy, the Historical Nation;;;;;;x;;;;;;;;;;;
EVTDESC600079;All over Italy, millions of joyous Italians are hearing of our quest to unify Italy, and are praising the name of Sicily and of God. Many are planning to join Garibaldi and rise against their state in the hopes of joining our illustrious nation.;;;;;;x;;;;;;;;;;;
EVTOPTA600079;Italy shall be ruled by true Italians!;;;;;;x;;;;;;;;;;;
EVTNAME600080;Italy, the Baffling Nation;;;;;;x;;;;;;;;;;;
EVTDESC600080;All over Italy, millions of confused Italians are hearing of our quest to unify Italy, and are wondering aloud how on earth a nation that was so small a few decades ago is now the dominant Italian power. Many are planning to join Garibaldi and rise against their state in the hopes of joining us, though most of them are only doing so after getting horribly drunk and doing it as a bet.;;;;;;x;;;;;;;;;;;
EVTOPTA600080;We are NOT too pussy to join the Redshirts, man.;;;;;;x;;;;;;;;;;;
EVTNAME600081;Italy, the Nation;;;;;;x;;;;;;;;;;;
EVTDESC600081;All over Italy, millions of joyous Italians are hearing of our quest to unify Italy, and are praising the name of our Kingd. Many are planning to join Garibaldi and rise against their state in the hopes of joining our nation.;;;;;;x;;;;;;;;;;;
EVTOPTA600081;Italy shall be ruled by true Italians!;;;;;;x;;;;;;;;;;;
EVTNAME600083;Garibaldi's Call;;;;;;x;;;;;;;;;;;
EVTDESC600083;After failing to fully unite the Italian peninsula around the midpoint of the century, Italian pan-nationalism lost some its allure, and few redshirts were to be seen. Now, however, a new generation of young men are again embracing the concept of a unified Italy, an Garibaldi has once more come into prominence, promising to once more recruit his voluntary militias to finally unify the Italian people.;;;;;;x;;;;;;;;;;;
EVTOPTA600083;What a troublemaker.;;;;;;x;;;;;;;;;;;
EVTNAME55000;The Frankfurt Assembly;;;;;;x;;;;;;;;;;;
EVTDESC55000;Admist the tide of liberal sentiment that has been unleashed upon the German states, calls by liberals for a unification of the German people have become especially prevalent. Huge demonstrations of pan-nationalists and a positive tone towards this action by the press occur almost daily, and it is feared that, whether the rulers of the German states like it or not, some sort of unification will be forced by the people. In response to this outpouring of support, an Assembly in Frankfurt has formed, made up of liberals dedicated to a unified Germany, and calls are being issued to all the nations to send delegates to agree to a common union.;;;;;;x;;;;;;;;;;;
EVTOPTA55000;What a headache.;;;;;;x;;;;;;;;;;;
EVTNAME55001;The Federation of the Rhine;;;;;;x;;;;;;;;;;;
EVTDESC55001;Enough states have sent delegations to Frankfurt to correctly say that a majority of the princes of the Confederation of the Rhine are in favor of unification. Thankfully, one of the Rhine states has recently emerged as the greatest among us, and as a first nation amongst equals, its ruler shall be offered the hereditary Presidency of the United Federation of the Rhine.;;;;;;x;;;;;;;;;;;
EVTOPTA55001;Deutschland ?er alles!;;;;;;x;;;;;;;;;;;
EVTNAME55002;The Federation of the Rhine;;;;;;x;;;;;;;;;;;
EVTDESC55002;The Frankfurt Assembly has sent a delegation to us today. Apparently, more than half of the Confederation states have decided to support the unification of the German peoples, and as the predominant power amongst the Rhine states, the Assembly has offered us the hereditary office of the Presidency of the United Federation of the Rhine. While accepting this would mean satisfying the liberal elements within our nation, along with considerable enlargement of our territory, many conservatives feel that the position they offer, and the liberal political constitution of the proposed state, is an illegitimate office, offered not by the grace of God, but by the liberal and unholy sentiments of modernity.;;;;;;x;;;;;;;;;;;
EVTOPTA55002;Deutschland ?er alles!;;;;;;x;;;;;;;;;;;
EVTOPTB55002;Smells like a gutter in here.;;;;;;x;;;;;;;;;;;
EVTNAME55003;The Federation of the Rhine;;;;;;x;;;;;;;;;;;
EVTDESC55003;Enough states have sent delegations to Frankfurt to correctly say that a majority of the princes of the Confederation of the Rhine are in favor of unification. Unfortunately, none of the Rhine states are currently prominent enough to be the obvious choice to lead a common union. As such, the Assembly has decided to offer the hereditary position of Presidency of the United Federation of the Rhine to one of the German states outside of the Confederation.;;;;;;x;;;;;;;;;;;
EVTOPTA55003;Deutschland ?er alles!;;;;;;x;;;;;;;;;;;
EVTNAME55004;The Federation of the Rhine;;;;;;x;;;;;;;;;;;
